{
  "$schema": "https://json-schema.org/draft/2020-12/schema",
  "$id": "https://ldttoolbox.example/poc/schemas/decision-table.schema.json",
  "title": "DecisionTable",
  "description": "Explainer output: the trace-back artifact answering 'where can I do what?'. Every row links at least one NormCard so each cell remains legally contestable (paper A/B explainability requirement).",
  "type": "object",
  "additionalProperties": false,
  "required": ["id", "title", "columns", "rows", "generatedBy", "generatedAt", "provenance"],
  "properties": {
    "id": { "type": "string", "pattern": "^DT-[A-Za-z0-9][A-Za-z0-9._-]*$" },
    "requestId": {
      "oneOf": [
        { "type": "string", "pattern": "^[0-9a-f]{8}-[0-9a-f]{4}-[0-9a-f]{4}-[0-9a-f]{4}-[0-9a-f]{12}$" },
        { "type": "string", "pattern": "^OMR-[A-Za-z0-9][A-Za-z0-9._-]*$" }
      ]
    },
    "title": { "type": "string", "minLength": 5 },
    "columns": {
      "type": "array",
      "minItems": 4,
      "uniqueItems": true,
      "items": { "type": "string", "minLength": 3 },
      "description": "must contain the canonical columns criterion, norm, source, zone effect (extra columns allowed)"
    },
    "rows": {
      "type": "array",
      "minItems": 1,
      "items": {
        "type": "object",
        "required": ["criterion", "norm", "source", "zone effect", "normCardId"],
        "properties": {
          "criterion": { "type": "string", "minLength": 3 },
          "norm": { "type": "string", "minLength": 3 },
          "source": { "type": "string", "minLength": 3 },
          "zone effect": { "enum": ["included", "excluded", "conditional", "attention", "compensation", "ambiguous", "not_applicable"] },
          "normCardId": { "type": "string", "pattern": "^NC-[A-Z]{1,4}-\\d{2,3}$" },
          "ruleId": { "type": "string", "pattern": "^FR-[A-Z]{1,4}-\\d{2,3}$" },
          "condition": { "type": "string" },
          "note": { "type": "string" }
        }
      }
    },
    "generatedBy": { "type": "string", "pattern": "^[a-z0-9][a-z0-9-]*#[A-Za-z0-9][A-Za-z0-9._-]*$" },
    "generatedAt": { "type": "string", "pattern": "^\\d{4}-\\d{2}-\\d{2}T\\d{2}:\\d{2}:\\d{2}(\\.\\d+)?(Z|[+-]\\d{2}:\\d{2})$" },
    "provenance": { "type": "string", "minLength": 10, "description": "PROV-O narrative or URI of the run, corpus version and rule set behind this table" }
  },
  "allOf": [
    { "properties": { "columns": { "contains": { "const": "criterion" } } } },
    { "properties": { "columns": { "contains": { "const": "norm" } } } },
    { "properties": { "columns": { "contains": { "const": "source" } } } },
    { "properties": { "columns": { "contains": { "const": "zone effect" } } } }
  ]
}
