{
 "id": "DT-werken-utrecht-poc1",
 "requestId": "6916a94b-e9d1-441a-9d88-28e2effa0b27",
 "title": "Werken rule bounds for business development Decision table (programming stage)",
 "columns": [
  "criterion",
  "norm",
  "source",
  "zone effect",
  "ruleId",
  "normCardId",
  "condition",
  "note"
 ],
 "rows": [
  {
   "criterion": "An omgevingsplan for locations within the 'Landelijk gebied' may allow percelen for specific stedelijke functies to change to another stedelijke functie (not being perma…",
   "norm": "Artikel 9.9 — Omgevingsverordening provincie Utrecht (CVDR704250, geldend 13-10-2025) - artikeltekst [binding]",
   "source": "S07: https://lokaleregelgeving.overheid.nl/cvdr704250",
   "zone effect": "conditional",
   "normCardId": "NC-WE-01",
   "ruleId": "FR-WE-01",
   "note": "Art. 9.9 instructieregel, kan-mits family for non-dwelling stedelijke functies in het Landelijk gebied: function change under an integral assessment (lid 1a) and expansion up to 20% of the bebouwingsmogelijkheden (lid 1b). The zone overlay is deterministic; both tests are plan-quality assessments routed to V4 — a conditional marker (FR-WN-05 idiom), never an elimination. | zones: landelijk_gebied"
  },
  {
   "criterion": "An omgevingsplan for locations within the 'Landelijk gebied' may allow ended agrarische bedrijfspercelen to receive a stedelijke functie (not being wonen) for the bedrij…",
   "norm": "Artikel 9.11 — Omgevingsverordening provincie Utrecht (CVDR704250, geldend 13-10-2025) - artikeltekst [binding]",
   "source": "S07: https://lokaleregelgeving.overheid.nl/cvdr704250",
   "zone effect": "conditional",
   "normCardId": "NC-WE-02",
   "ruleId": "FR-WE-02",
   "note": "Art. 9.11 instructieregel, kan-mits family: ended agrarische bedrijfspercelen may receive a stedelijke functie (not wonen) mits five conditions including the 50% demolition norm with six exception categories. A conditional marker routed to V4 (FR-WN-05 idiom), never an elimination. | zones: landelijk_gebied"
  },
  {
   "criterion": "An omgevingsplan for locations within the 'Gebied uitbreiding bedrijventerrein onder voorwaarden mogelijk' may contain rules for expansion of bedrijventerreinen, provide…",
   "norm": "Artikel 9.16 — Omgevingsverordening provincie Utrecht (CVDR704250, geldend 13-10-2025) - artikeltekst [binding]",
   "source": "S07: https://lokaleregelgeving.overheid.nl/cvdr704250",
   "zone effect": "included",
   "normCardId": "NC-WE-03",
   "ruleId": "FR-WE-03",
   "note": "Art. 9.16 instructieregel: plans within the 'Gebied uitbreiding bedrijventerrein onder voorwaarden mogelijk' may contain rules for bedrijventerrein expansion mits eight conditions. A verordeningeigen exception to art. 9.3 for business development — INCLUSION zone (the FR-W-05/FR-WN-09 idiom); the mits conditions are plan-quality assessments routed to V4. | zones: gebied_uitbreiding_bedrijventerre…"
  },
  {
   "criterion": "An omgevingsplan for locations within the 'Stedelijk gebied' may contain rules for bedrijventerreinen, provided the same eight stated conditions as art.",
   "norm": "Artikel 9.18 — Omgevingsverordening provincie Utrecht (CVDR704250, geldend 13-10-2025) - artikeltekst [binding]",
   "source": "S07: https://lokaleregelgeving.overheid.nl/cvdr704250",
   "zone effect": "included",
   "normCardId": "NC-WE-04",
   "ruleId": "FR-WE-04",
   "note": "Art. 9.18 instructieregel: plans within the 'Stedelijk gebied' may contain rules for bedrijventerreinen mits the same eight conditions as art. 9.16. INCLUSION zone on the reused stedelijk-gebied alias (FR-WN-10 idiom); mits conditions routed to V4. | zones: stedelijk_gebied"
  },
  {
   "criterion": "The general kantoren restriction of art. 9.19 lid 1-2 (nieuwvestiging of zelfstandige kantoren only under three narrow cases) does not apply within het 'Gebied Kantoor o…",
   "norm": "Artikel 9.19 — Omgevingsverordening provincie Utrecht (CVDR704250, geldend 13-10-2025) - artikeltekst [binding]",
   "source": "S07: https://lokaleregelgeving.overheid.nl/cvdr704250",
   "zone effect": "conditional",
   "normCardId": "NC-WE-05",
   "ruleId": "FR-WE-05",
   "note": "Art. 9.19 instructieregel: lid 1-2 carry a zone-loze restriction on nieuwvestiging of zelfstandige kantoren (carried in the tags per the FR-LB-01/8.4 zone-loos precedent — the engine refuses zone-less exclusion rules and a blanket marker on the whole AOI would overstate a lid that mostly governs plan content), while lids 3-6 open zone-gebonden uitzonderings-/verplaatsingskaders on the four design…"
  },
  {
   "criterion": "An omgevingsplan for locations within the 'Gebied detailhandel buiten bestaand winkelgebied' contains no rules providing for nieuwvestiging or uitbreiding of detailhande…",
   "norm": "Artikel 9.20 — Omgevingsverordening provincie Utrecht (CVDR704250, geldend 13-10-2025) - artikeltekst [binding]",
   "source": "S07: https://lokaleregelgeving.overheid.nl/cvdr704250",
   "zone effect": "conditional",
   "normCardId": "NC-WE-06",
   "ruleId": "FR-WE-06",
   "note": "Art. 9.20 instructieregel, lid 1 quoted: plans within the 'Gebied detailhandel buiten bestaand winkelgebied' contain no rules providing for nieuwvestiging/uitbreiding of detailhandel nor brancheringswijziging, tenzij seven stated exceptions (a-g). RE-ADJUDICATED at the canonical run (the FR-WN-03 mirror): the verbod is SUB-CLASS-scoped — it refuses detailhandel development only, while arts. 9.16/…"
  }
 ],
 "generatedBy": "explainer#deterministic-poc1",
 "generatedAt": "2026-10-06T12:19:28Z",
 "provenance": "run 20261006T121921Z-werken of poc-run/1.0; norm corpus poc/corpus/evidence-werken.json replayed by legal-recon-agent#cvdr704250-geldend-2025-10-13; rules by norm-formalizer#deterministic-templates-v1; instrument Omgevingsverordening provincie Utrecht, CVDR704250 geldend 13-10-2025 t/m heden; zone geometry from provincial open data (agrest Omgevingsverordening FeatureServer + province ArcGIS hub), lastChecked stamps in layers.json; full PROV in prov.json"
}
