{
 "id": "DT-recreatie-be-nspd",
 "requestId": "90bff7d5-9185-5bc3-b1d9-c9993e03637e",
 "title": "Where can recreation development occur in the Flemish part of the NSPD? Decision table (programming stage)",
 "columns": [
  "criterion",
  "norm",
  "source",
  "zone effect",
  "ruleId",
  "normCardId",
  "condition",
  "note"
 ],
 "rows": [
  {
   "criterion": "The GRUP designates a recreation area within the seaport plan area for Evergem, Gent and Zelzate..",
   "norm": "Artikel 12 — GRUP afbakening zeehavengebied Gent - fase 2 (Bijlage II SV) (GRUP 2.12_00358_00001, Bijlage II Stedenbouwkundige voorschriften 'afbakening zeehavengebied Gent - fase 2' (kopregel document)) [binding]",
   "source": "S02: https://download.dsi.omgeving.vlaanderen.be/be.vl.omg.dsi.stukonderdeel.RUP_02000_212_00358_00001.BG.3.Dossierstuk.SV.1_1",
   "zone effect": "ambiguous",
   "normCardId": "NC-REC-01",
   "ruleId": "FR-REC-01",
   "note": "Recreatiegebied in GRUP; quote bevat paginakop-artefact letterlijk (sic); cartografisch → zone-loos, V4. Zone-loos gedocumenteerd; routeert naar V4."
  },
  {
   "criterion": "The Gewestplan designates areas for tourist holiday parks, indicated on the designation maps in orange..",
   "norm": "Artikel 1 — Aanvullende SV gewestplannen (o.a. Gentse en Kanaalzone 08) (Bijlage 3: teksten aanvullende stedenbouwkundige voorschriften (per gewestplan; incl. gewestplan Gentse en Kanaalzone 08), toestand 1 januari 2002) [binding]",
   "source": "S04: https://omgeving.vlaanderen.be/sites/default/files/2021-11/bijlage_3_aanvullende_voorschriften_stedenbouwkundige%20gewestplannen.pdf",
   "zone effect": "ambiguous",
   "normCardId": "NC-REC-02",
   "ruleId": "FR-REC-02",
   "note": "Toeristisch recreatiepark (KB 6/12/76); parallel aan NL-verblijfsrecreatie; cartografisch → zone-loos. Zone-loos gedocumenteerd; routeert naar V4."
  },
  {
   "criterion": "orchestrator-basis: request-AOI (constructie, geen norm)",
   "norm": "run.py orchestrator FR-AOI-01 — geen rechtsbron [uitvoeringsconstructie]",
   "source": "use-cases/recreatie-be.json (bbox.py NSPD_BBOX_WGS84, EPSG:28992); geen document",
   "zone effect": "included",
   "normCardId": "NC-REC-01",
   "ruleId": "FR-AOI-01",
   "note": "included (aoi-basis) — geen bijgaande kaart geciteerd: geen inclusion-regel in deze shard is executabel (zone-loos, V4). Taak-9-zone-semantiek: de inclusion-regels van deze track/jurisdictie (FR-REC-01, FR-REC-02) zijn zone-loos naar V4 gerouteerd; de run gebruikt de request-AOI als inclusion-union (run_summary.inclusionBasis=aoi) zodat V4-markers en exclusions op een gedefinieerd werkvlak worden uitgevoerd. Deze regel is een uitvoeringsconstructie van de orchestrator, geen inhoudelijke norm."
  }
 ],
 "generatedBy": "explainer#deterministic-poc1",
 "generatedAt": "2026-10-15T05:43:22Z",
 "provenance": "run 20261015T054322Z-recreatie-be of poc-nspd-run/1.0; curated norm corpus poc-nspd/corpus/normcards-be-recreatie.json (taak 6/7: curator#poc-nspd-fase2-t7) with formal rules poc-nspd/corpus/formal-rules-be-recreatie.json (norm-formalizer#poc-nspd-fase2-t7, run-orchestrator#poc-nspd-task9-aoi-basis); instrument GRUP Zeehavengebied Gent fase 2 / gewestplan / VCRO (Vlaanderen); zone geometry from pinned national open-data aliases (ZONE_SOURCES), lastChecked stamps in layers.json; V2b jurisdictie-gate pass; full PROV in prov.json"
}
