{
 "id": "DT-bos-utrecht-poc1",
 "requestId": "9d4b7e22-1a3c-4f5b-8e90-2a6c0f4d1b57",
 "title": "Where can new nature / forest planting be realised in province Utrecht? Decision table (programming stage)",
 "columns": [
  "criterion",
  "norm",
  "source",
  "zone effect",
  "ruleId",
  "normCardId",
  "condition",
  "note"
 ],
 "rows": [
  {
   "criterion": "An omgevingsplan for locations within the Groene contour must contain rules that protect and create the possibilities to realise new nature on the grounds within the Gro…",
   "norm": "art. 6.4, eerste lid — Omgevingsverordening provincie Utrecht (CVDR704250, geldend 13-10-2025) - artikeltekst [binding]",
   "source": "S07: https://lokaleregelgeving.overheid.nl/cvdr704250",
   "zone effect": "included",
   "normCardId": "NC-B-01",
   "ruleId": "FR-B-01",
   "note": "CORE BOS RULE. Art. 6.4 lid 1 directs omgevingsplannen within the Groene contour to protect and create the possibilities to realise new nature; the contour is thereby the provincial search area (zoekgebied) for new nature — including forest planting via voluntary conversion, added to the NNN after realisation. Formalized as the opportunity inclusion for the forest_planting object type; the volunt…"
  },
  {
   "criterion": "The remaining loss of possibilities to realise new nature must be compensated by realising new nature within the Groene contour with an area of at least the area of the…",
   "norm": "art. 6.5, tweede lid (onder d) — Omgevingsverordening provincie Utrecht (CVDR704250, geldend 13-10-2025) - artikeltekst [binding]",
   "source": "S07: https://lokaleregelgeving.overheid.nl/cvdr704250",
   "zone effect": "compensation",
   "normCardId": "NC-B-02",
   "ruleId": "FR-B-02",
   "condition": "compensation_ratio_new_nature >= 1 ratio",
   "note": "Art. 6.5 lid 2 under d requires >= 1:1 compensation with new nature within the contour for the remaining loss of new-nature possibilities. For the BOS track this is the contour's protection regime attached as an obligation (marker), mirroring FR-W-15 for wind; it never eliminates the zoekgebied itself. | zones: groene_contour | GIO: /join/id/regdata/pv26/2025/gioee37db62-22b1-4334-bf89-7ddf4e5812…"
  },
  {
   "criterion": "An omgevingsplan for locations within the 'Waardevolle Houtopstanden - oude bosgroeiplaatsen' must contain rules for the protection and conservation of the values presen…",
   "norm": "art. 6.13, eerste lid — Omgevingsverordening provincie Utrecht (CVDR704250, geldend 13-10-2025) - artikeltekst [binding]",
   "source": "S07: https://lokaleregelgeving.overheid.nl/cvdr704250",
   "zone effect": "conditional",
   "normCardId": "NC-B-03",
   "ruleId": "FR-B-03",
   "note": "Art. 6.13 lid 1 is an instructieregel directing omgevingsplannen within the 'Waardevolle Houtopstanden - oude bosgroeiplaatsen' to protect and conserve the old-forest values present at those locations. The zone overlay is deterministic; whether a specific planting spares the values is a case-specific assessment marked for human review (V4), not guessed. | zones: oude_bosgroeiplaatsen | GIO: /join…"
  },
  {
   "criterion": "Within the Gebied houtopstand, making rejuvenation gaps is exempt from the national velling-reporting duty provided the gaps are not larger than 10 are, jointly cover at…",
   "norm": "art. 6.15, onder a — Omgevingsverordening provincie Utrecht (CVDR704250, geldend 13-10-2025) - artikeltekst [binding]",
   "source": "S07: https://lokaleregelgeving.overheid.nl/cvdr704250",
   "zone effect": "ambiguous",
   "normCardId": "NC-B-04",
   "ruleId": "FR-B-04",
   "note": "Art. 6.15 under a exempts small rejuvenation gaps (<= 10 are, jointly <= 10% of the parcel, <= 1x per 4 years, sustainable forest management) from the national velling-reporting duty within the Gebied houtopstand: a forest-management reporting exemption, not an opportunity-siting predicate for new nature/forest."
  },
  {
   "criterion": "The (non-binding) Omgevingsvisie 2021 aims to realise 3,000 hectares of new nature within the Groene contour by 2040, ecologically connecting large nature units, and exp…",
   "norm": "par. Natuur (Utrechtse kwaliteit en opgave) — Omgevingsvisie provincie Utrecht (PS 10-03-2021, in werking 01-04-2021) - NIET-BINDENDE ambitie [non_binding]",
   "source": "S14: https://www.provincie-utrecht.nl/media/8648",
   "zone effect": "not_applicable",
   "normCardId": "NC-B-05",
   "ruleId": "FR-B-05",
   "note": "Non-binding visie ambition (3,000 ha new nature by 2040 within the Groene contour; woodstand expansion for CO2); it quantifies the opgave but adds no rule — the binding zoekgebied is already formalized from NC-B-01."
  }
 ],
 "generatedBy": "explainer#deterministic-poc1",
 "generatedAt": "2026-08-30T14:24:49Z",
 "provenance": "run 20260830T142446Z-bos of poc-run/1.0; norm corpus poc/corpus/evidence-bos.json replayed by legal-recon-agent#cvdr704250-geldend-2025-10-13; rules by norm-formalizer#deterministic-templates-v1; instrument Omgevingsverordening provincie Utrecht, CVDR704250 geldend 13-10-2025 t/m heden; zone geometry from provincial open data (agrest Omgevingsverordening FeatureServer + province ArcGIS hub), lastChecked stamps in layers.json; full PROV in prov.json"
}
