{
 "id": "DT-water-nl-nspd",
 "requestId": "e28886cf-6b65-58ac-b21f-c9d35c0886ec",
 "title": "Where can riparian development occur in the Dutch part of the NSPD? Decision table (programming stage)",
 "columns": [
  "criterion",
  "norm",
  "source",
  "zone effect",
  "ruleId",
  "normCardId",
  "condition",
  "note"
 ],
 "rows": [
  {
   "criterion": "A permit for an activity with possible consequences for a KRW surface-water or groundwater body may not lead to non-compliance with the applicable environmental values a…",
   "norm": "Artikel 2.4 — Omgevingsverordening Zeeland (CVDR709135, geldend van 02-06-2026 t/m heden) [binding]",
   "source": "S01: https://lokaleregelgeving.overheid.nl/CVDR709135",
   "zone effect": "ambiguous",
   "normCardId": "NC-WAT-01",
   "ruleId": "FR-WAT-01",
   "note": "Beoordelingsregel waterlichaam; delta-breed, zone-loos conditioneel. Zone-loos gedocumenteerd; routeert naar V4."
  },
  {
   "criterion": "It is prohibited, without an omgevingsvergunning, to remove, hold or transport aquatic plants and animals (or objects evidently serving that purpose) along, on or under…",
   "norm": "Artikel 13.4 — Omgevingsverordening Zeeland (CVDR709135, geldend van 02-06-2026 t/m heden) [binding]",
   "source": "S01: https://lokaleregelgeving.overheid.nl/CVDR709135",
   "zone effect": "ambiguous",
   "normCardId": "NC-WAT-02",
   "ruleId": "FR-WAT-02",
   "note": "Vergunningplicht onderwater flora/fauna: verbod zonder vergunning; zone-loos (oppervlaktewaterlichamen niet als GIO gepind). Zone-loos gedocumenteerd; routeert naar V4."
  },
  {
   "criterion": "Activities within a restriction zone of a regional flood defence are only permitted if no obstruction arises for the maintenance, safety or reinforcement of that defence…",
   "norm": "Artikel 18.37 — Omgevingsverordening Zeeland (CVDR709135, geldend van 02-06-2026 t/m heden) [binding]",
   "source": "S01: https://lokaleregelgeving.overheid.nl/CVDR709135",
   "zone effect": "ambiguous",
   "normCardId": "NC-WAT-03",
   "ruleId": "FR-WAT-03",
   "note": "Instructieregel regionale waterkeringen; kaart 'regionale waterkeringen' niet als geo-pin in dit corpus → zone-loze exclusion met caveat. Zone-loos gedocumenteerd; routeert naar V4."
  },
  {
   "criterion": "orchestrator-basis: request-AOI (constructie, geen norm)",
   "norm": "run.py orchestrator FR-AOI-01 — geen rechtsbron [uitvoeringsconstructie]",
   "source": "use-cases/water-nl.json (bbox.py NSPD_BBOX_WGS84, EPSG:28992); geen document",
   "zone effect": "included",
   "normCardId": "NC-WAT-01",
   "ruleId": "FR-AOI-01",
   "note": "included (aoi-basis) — geen bijgaande kaart geciteerd: geen inclusion-regel in deze shard is executabel (zone-loos, V4). Taak-9-zone-semantiek: de inclusion-regels van deze track/jurisdictie (geen) zijn zone-loos naar V4 gerouteerd; de run gebruikt de request-AOI als inclusion-union (run_summary.inclusionBasis=aoi) zodat V4-markers en exclusions op een gedefinieerd werkvlak worden uitgevoerd. Deze regel is een uitvoeringsconstructie van de orchestrator, geen inhoudelijke norm."
  }
 ],
 "generatedBy": "explainer#deterministic-poc1",
 "generatedAt": "2026-10-15T02:08:26Z",
 "provenance": "run 20261015T020825Z-water-nl of poc-nspd-run/1.0; curated norm corpus poc-nspd/corpus/normcards-nl-water.json (taak 6/7: curator#poc-nspd-fase2-t3) with formal rules poc-nspd/corpus/formal-rules-nl-water.json (norm-formalizer#poc-nspd-fase2-t3, run-orchestrator#poc-nspd-task9-aoi-basis); instrument Omgevingsverordening provincie Zeeland, CVDR709135 geldend 02-06-2026 t/m heden; zone geometry from pinned national open-data aliases (ZONE_SOURCES), lastChecked stamps in layers.json; V2b jurisdictie-gate pass; full PROV in prov.json"
}
