{
 "id": "DT-biomassa-utrecht-poc1",
 "requestId": "91ae7dfc-2c8b-4fcc-9136-48d6418bfd4b",
 "title": "Biomassa rule bounds for biomass installation Decision table (programming stage)",
 "columns": [
  "criterion",
  "norm",
  "source",
  "zone effect",
  "ruleId",
  "normCardId",
  "condition",
  "note"
 ],
 "rows": [
  {
   "criterion": "An omgevingsplan for locations within the 'Gebied energie uit biomassa landelijk gebied' may contain rules allowing developments for energy from biomass, provided the st…",
   "norm": "Artikel 5.6 — Omgevingsverordening provincie Utrecht (CVDR704250, geldend 13-10-2025) - artikeltekst [binding]",
   "source": "S07: https://lokaleregelgeving.overheid.nl/cvdr704250",
   "zone effect": "conditional",
   "normCardId": "NC-BM-01",
   "ruleId": "FR-BM-01",
   "note": "CORE BIOMASSA RULE (art. 5.6). Instructieregel directing omgevingsplannen for locations within the 'Gebied energie uit biomassa landelijk gebied' that they may contain rules allowing developments for energy from biomass, provided the quoted first-lid conditions are met (kleinschalige biomassa-installaties in aansluiting on existing bebouwde agrarische bouwpercelen or legale (half)verhardingen on…"
  },
  {
   "criterion": "An omgevingsplan for locations within the 'Gebied energie uit biomassa stedelijk gebied' contains no rules allowing developments for energy from biomass, unless four cum…",
   "norm": "Artikel 5.7 — Omgevingsverordening provincie Utrecht (CVDR704250, geldend 13-10-2025) - artikeltekst [binding]",
   "source": "S07: https://lokaleregelgeving.overheid.nl/cvdr704250",
   "zone effect": "conditional",
   "normCardId": "NC-BM-02",
   "ruleId": "FR-BM-02",
   "note": "Art. 5.7 instructieregel, non-permission family with fourfold tenzij: plans within the 'Gebied energie uit biomassa stedelijk gebied' contain no rules allowing developments for energy from biomass unless (a) no reasonable alternative renewable sources, (b) biomass not usable for higher-value applications, (c) certified biomass, and (d) substantially lower CO2 emission than conventional fossil fue…"
  }
 ],
 "generatedBy": "explainer#deterministic-poc1",
 "generatedAt": "2026-10-06T12:01:34Z",
 "provenance": "run 20261006T120133Z-biomassa of poc-run/1.0; norm corpus poc/corpus/evidence-biomassa.json replayed by legal-recon-agent#cvdr704250-geldend-2025-10-13; rules by norm-formalizer#deterministic-templates-v1; instrument Omgevingsverordening provincie Utrecht, CVDR704250 geldend 13-10-2025 t/m heden; zone geometry from provincial open data (agrest Omgevingsverordening FeatureServer + province ArcGIS hub), lastChecked stamps in layers.json; full PROV in prov.json"
}
