{
 "id": "DT-landschap-nl-nspd",
 "requestId": "4c714036-67a6-5c68-8785-7f93e6047d33",
 "title": "Where can landscape intervention occur in the Dutch part of the NSPD? Decision table (programming stage)",
 "columns": [
  "criterion",
  "norm",
  "source",
  "zone effect",
  "ruleId",
  "normCardId",
  "condition",
  "note"
 ],
 "rows": [
  {
   "criterion": "An omgevingsplan setting rules for land within a 100-metre assessment zone around an existing nature area must motivate how the nature area is taken into account..",
   "norm": "Artikel 18.41 — Omgevingsverordening Zeeland (CVDR709135, geldend van 02-06-2026 t/m heden) [binding]",
   "source": "S01: https://lokaleregelgeving.overheid.nl/CVDR709135",
   "zone effect": "ambiguous",
   "normCardId": "NC-LAN-01",
   "ruleId": "FR-LAN-01",
   "note": "Afwegingszone natuurgebieden (bijlage XII/4): motiveringseis; zone (100m rond natuurgebied) zonder geo-pin → zone-loos. Zone-loos gedocumenteerd; routeert naar V4."
  },
  {
   "criterion": "An omgevingsplan affecting landscapes, landscape elements or cultural-historically valuable farms must provide insight into the landscape and cultural-historic values in…",
   "norm": "Artikel 18.42 — Omgevingsverordening Zeeland (CVDR709135, geldend van 02-06-2026 t/m heden) [binding]",
   "source": "S01: https://lokaleregelgeving.overheid.nl/CVDR709135",
   "zone effect": "ambiguous",
   "normCardId": "NC-LAN-02",
   "ruleId": "FR-LAN-02",
   "note": "Landschap en erfgoed (bijlage VII): motiveringseis landschapskwaliteit; kernlandschapsnorm, zone-loos. Zone-loos gedocumenteerd; routeert naar V4."
  },
  {
   "criterion": "orchestrator-basis: request-AOI (constructie, geen norm)",
   "norm": "run.py orchestrator FR-AOI-01 — geen rechtsbron [uitvoeringsconstructie]",
   "source": "use-cases/landschap-nl.json (bbox.py NSPD_BBOX_WGS84, EPSG:28992); geen document",
   "zone effect": "included",
   "normCardId": "NC-LAN-01",
   "ruleId": "FR-AOI-01",
   "note": "included (aoi-basis) — geen bijgaande kaart geciteerd: geen inclusion-regel in deze shard is executabel (zone-loos, V4). Taak-9-zone-semantiek: de inclusion-regels van deze track/jurisdictie (geen) zijn zone-loos naar V4 gerouteerd; de run gebruikt de request-AOI als inclusion-union (run_summary.inclusionBasis=aoi) zodat V4-markers en exclusions op een gedefinieerd werkvlak worden uitgevoerd. Deze regel is een uitvoeringsconstructie van de orchestrator, geen inhoudelijke norm."
  }
 ],
 "generatedBy": "explainer#deterministic-poc1",
 "generatedAt": "2026-10-15T05:17:34Z",
 "provenance": "run 20261015T051733Z-landschap-nl of poc-nspd-run/1.0; curated norm corpus poc-nspd/corpus/normcards-nl-landschap.json (taak 6/7: curator#poc-nspd-fase2-t5) with formal rules poc-nspd/corpus/formal-rules-nl-landschap.json (norm-formalizer#poc-nspd-fase2-t5, run-orchestrator#poc-nspd-task9-aoi-basis); instrument Omgevingsverordening provincie Zeeland, CVDR709135 geldend 02-06-2026 t/m heden; zone geometry from pinned national open-data aliases (ZONE_SOURCES), lastChecked stamps in layers.json; V2b jurisdictie-gate pass; full PROV in prov.json"
}
