{
 "id": "DT-werken-be-nspd",
 "requestId": "1be48754-5db8-5188-86c1-266742b5cd3e",
 "title": "Where can business development occur in the Flemish part of the NSPD? Decision table (programming stage)",
 "columns": [
  "criterion",
  "norm",
  "source",
  "zone effect",
  "ruleId",
  "normCardId",
  "condition",
  "note"
 ],
 "rows": [
  {
   "criterion": "The GRUP designates an area for seaport- and water-bound companies that must function as the Flemish seaport area of the port of Ghent..",
   "norm": "Artikel 13 — GRUP afbakening zeehavengebied Gent - fase 2 (Bijlage II SV) (GRUP 2.12_00358_00001, Bijlage II Stedenbouwkundige voorschriften 'afbakening zeehavengebied Gent - fase 2' (kopregel document)) [binding]",
   "source": "S02: https://download.dsi.omgeving.vlaanderen.be/be.vl.omg.dsi.stukonderdeel.RUP_02000_212_00358_00001.BG.3.Dossierstuk.SV.1_1",
   "zone effect": "included",
   "normCardId": "NC-WER-01",
   "ruleId": "FR-WER-01",
   "note": "Formalized (fase 3, task 4): GRUP fase 2 artikel 13 wijst het gebied voor zeehaven- en watergebonden bedrijven aan als Vlaams zeehavengebied."
  },
  {
   "criterion": "The GRUP zone is exclusively destined for seaport- and water-bound industrial companies, distribution, logistics and storage companies serving the paper-producing plant..",
   "norm": "Artikel 1 — GRUP uitbreiding papierproducerend bedrijf (Bijlage III SV) (GRUP zeehavengebied Gent - uitbreiding papierproducerend bedrijf, Bijlage III Stedenbouwkundige voorschriften (titelpagina; vaststellingsdatum niet vermeld in SV-extract)) [binding]",
   "source": "S03: https://download.dsi.omgeving.vlaanderen.be/be.vl.omg.dsi.stukonderdeel.RUP_02000_212_00008_00001.BG.3.Dossierstuk.SV.1_1",
   "zone effect": "included",
   "normCardId": "NC-WER-02",
   "ruleId": "FR-WER-02",
   "note": "Formalized (fase 3, task 4): GRUP papierproducent artikel 1 — uitsluitend bestem voor zeehaven- en watergebonden bedrijven ten dienste van de papierproducent."
  }
 ],
 "generatedBy": "explainer#deterministic-poc1",
 "generatedAt": "2026-10-16T15:08:38Z",
 "provenance": "run 20261016T150837Z-werken-be of poc-nspd-run/1.0; curated norm corpus poc-nspd/corpus/normcards-be-werken.json (taak 6/7: curator#poc-nspd-fase2-t6) with formal rules poc-nspd/corpus/formal-rules-be-werken.json (norm-formalizer#poc-nspd-fase3-task4); instrument GRUP Zeehavengebied Gent fase 2 / gewestplan / VCRO (Vlaanderen); zone geometry from pinned national open-data aliases (ZONE_SOURCES), lastChecked stamps in layers.json; V2b jurisdictie-gate pass; full PROV in prov.json"
}
