{
 "id": "DT-biomassa-nl-nspd",
 "requestId": "abf76042-52bc-5ca3-904c-9e61e848da17",
 "title": "Where can biomass installations be sited in the Dutch part of the NSPD? Decision table (programming stage)",
 "columns": [
  "criterion",
  "norm",
  "source",
  "zone effect",
  "ruleId",
  "normCardId",
  "condition",
  "note"
 ],
 "rows": [
  {
   "criterion": "Discharges into or onto the soil are prohibited within a water-abstraction area..",
   "norm": "Artikel 5.31 — Omgevingsverordening Zeeland (CVDR709135, geldend van 02-06-2026 t/m heden) [binding]",
   "source": "S01: https://lokaleregelgeving.overheid.nl/CVDR709135",
   "zone effect": "ambiguous",
   "normCardId": "NC-BIO-01",
   "ruleId": "FR-BIO-01",
   "note": "Lozingsverbod waterwingebied; raakvlak biomassa-installaties (digestaat) curator-interpretaal, claim dekt alléén het citaat. Zone-loos gedocumenteerd; routeert naar V4."
  },
  {
   "criterion": "Discharges into or onto the soil within a groundwater protection zone are prohibited without an omgevingsvergunning..",
   "norm": "Artikel 5.32 — Omgevingsverordening Zeeland (CVDR709135, geldend van 02-06-2026 t/m heden) [binding]",
   "source": "S01: https://lokaleregelgeving.overheid.nl/CVDR709135",
   "zone effect": "ambiguous",
   "normCardId": "NC-BIO-02",
   "ruleId": "FR-BIO-02",
   "note": "Vergunningplicht lozingen grondwaterbeschermingszone; zelfde raakvlak-notitie. Zone-loos gedocumenteerd; routeert naar V4."
  },
  {
   "criterion": "orchestrator-basis: request-AOI (constructie, geen norm)",
   "norm": "run.py orchestrator FR-AOI-01 — geen rechtsbron [uitvoeringsconstructie]",
   "source": "use-cases/biomassa-nl.json (bbox.py NSPD_BBOX_WGS84, EPSG:28992); geen document",
   "zone effect": "included",
   "normCardId": "NC-BIO-01",
   "ruleId": "FR-AOI-01",
   "note": "included (aoi-basis) — geen bijgaande kaart geciteerd: geen inclusion-regel in deze shard is executabel (zone-loos, V4). Taak-9-zone-semantiek: de inclusion-regels van deze track/jurisdictie (geen) zijn zone-loos naar V4 gerouteerd; de run gebruikt de request-AOI als inclusion-union (run_summary.inclusionBasis=aoi) zodat V4-markers en exclusions op een gedefinieerd werkvlak worden uitgevoerd. Deze regel is een uitvoeringsconstructie van de orchestrator, geen inhoudelijke norm."
  }
 ],
 "generatedBy": "explainer#deterministic-poc1",
 "generatedAt": "2026-10-15T05:21:48Z",
 "provenance": "run 20261015T052147Z-biomassa-nl of poc-nspd-run/1.0; curated norm corpus poc-nspd/corpus/normcards-nl-biomassa.json (taak 6/7: curator#poc-nspd-fase2-t7) with formal rules poc-nspd/corpus/formal-rules-nl-biomassa.json (norm-formalizer#poc-nspd-fase2-t7, run-orchestrator#poc-nspd-task9-aoi-basis); instrument Omgevingsverordening provincie Zeeland, CVDR709135 geldend 02-06-2026 t/m heden; zone geometry from pinned national open-data aliases (ZONE_SOURCES), lastChecked stamps in layers.json; V2b jurisdictie-gate pass; full PROV in prov.json"
}
